h3_res8,total_violations,avg_severity,max_severity,avg_lane_blockage,max_lane_blockage,avg_vehicle_size,unique_hours,unique_days,lat_center,lng_center,road_multiplier,is_junction,junction_boost,vehicle_entropy,temporal_persistence,dominant_violation,dominant_vehicle,police_station,junction_name,location_name,D_norm,S_norm,P_norm,R_norm,V_norm,cis_raw,cis_score,cis_category,carriageway_reduction
88618925e1fffff,9,3.2314814814814814,4.0,42.22222222222222,70,1.2555555555555555,5,6,12.949757255555555,77.62420454444445,2.0,False,1.0,2.0588138896098536,0.20833333333333334,NO PARKING,CAR,Ashok Nagar,No Junction,"Ejipura Main Road, Dr BR Ambedkar Nagar, Viveka Nagar, Bengaluru, Karnataka. Pin-560047 (India)",0.0008910670527957229,0.6584362139917695,0.20833333333333334,1.0,0.6723065560139174,0.36991089809489447,45.12362519907413,moderate,6.333333333333333
88618925e3fffff,1,2.5,2.5,25.0,25,1.3,1,1,12.9458901,77.6186614,1.0,False,1.0,-1.4426951601859516e-10,0.041666666666666664,WRONG PARKING,CAR,Adugodi,No Junction,"Srinivagilu Main Road, Rajendra Nagar, Koramangala, Bengaluru, Karnataka. Pin-560047 (India)",0.0,0.3333333333333333,0.041666666666666664,0.0,0.0,0.08958333333333333,10.34013312847735,low,2.5
88618925e7fffff,20,2.7041666666666666,3.3333333333333335,28.0,50,0.78,8,10,12.954264154999999,77.62016621000001,2.0,False,1.0,1.9464393439496679,0.3333333333333333,WRONG PARKING,SCOOTER,Ashok Nagar,No Junction,"Lower Agaram Road, Sannenahalli, Viveka Nagar, Bengaluru, Karnataka. Pin-560047 (India)",0.0021162842503898416,0.42407407407407405,0.3333333333333333,1.0,0.63561060007909,0.3275022517999627,39.861492617216896,low,5.6
88618925e9fffff,55,2.618181818181818,3.0,26.454545454545453,30,0.7254545454545455,9,34,12.938034074545456,77.62681973636364,1.3,False,1.0,1.7210586111867539,0.375,WRONG PARKING,SCOOTER,Adugodi,No Junction,"Srinivagilu Main Road, Sony World Junction, Koramangala, Bengaluru, Karnataka. Pin-560034 (India)",0.00601470260637113,0.38585858585858585,0.375,0.30000000000000004,0.5620124254262931,0.23548005128066124,28.443230967476723,low,4.279411764705882
88618925ebfffff,88,2.827651515151515,3.75,28.863636363636363,50,1.044318181818182,12,32,12.9412392125,77.62152693522727,2.0,False,1.0,2.2137276928031144,0.5,NO PARKING,CAR,Adugodi,No Junction,"20th Main Road, KR Garden, Block 8, Koramangala, Bengaluru, Karnataka. Pin-560095 (India)",0.009690354199153487,0.47895622895622897,0.5,1.0,0.7228937246852524,0.37547766147362344,45.81435809224361,moderate,7.9375
88618925edfffff,7,2.5,2.5,25.0,25,1.542857142857143,3,3,12.946984185714285,77.62861177142858,1.0,False,1.0,1.1488348538481081,0.125,WRONG PARKING,CAR,Ashok Nagar,No Junction,"Ejipura Main Road, Gowda Muniswamy Garden, Ejipura, Bengaluru, Karnataka. Pin-560047 (India)",0.0006683002895967921,0.3333333333333333,0.125,0.0,0.37515251279396045,0.1322960244437292,15.639992076761642,low,5.833333333333334
8861892601fffff,1,3.0,3.0,30.0,30,1.3,1,1,12.8390489,77.6571115,1.0,False,1.0,-1.4426951601859516e-10,0.041666666666666664,NO PARKING,CAR,Electronic City,No Junction,"Neeladri Road, Himagiri Residency, Bettadasanapura, Bengaluru, Karnataka. Pin-560100 (India)",0.0,0.5555555555555556,0.041666666666666664,0.0,0.0,0.1451388888888889,17.233555214128916,low,3.0
8861892603fffff,5,3.0,3.0,30.0,30,1.34,4,4,12.840567859999998,77.65136820000001,1.0,False,1.0,1.37095059402186,0.16666666666666666,NO PARKING,CAR,Electronic City,No Junction,"Neeladri Road, Concord Silicon Valley, Phase 1, Electronic City, Bengaluru, Karnataka. Pin-560100 (India)",0.00044553352639786146,0.5555555555555556,0.16666666666666666,0.0,0.4476845027207096,0.19983730916446502,24.02062258493126,low,3.75
8861892605fffff,12,2.8333333333333335,3.0,27.916666666666668,30,0.85,6,10,12.841876158333333,77.66405331666667,1.3,False,1.0,1.7295739579365443,0.25,NO PARKING,SCOOTER,Electronic City,No Junction,"1st Main Road, Phase 1, Electronic City, Bengaluru, Karnataka. Pin-560100 (India)",0.001225217197594119,0.48148148148148157,0.25,0.30000000000000004,0.5647931155484585,0.23942138477352531,28.932277923716015,low,3.35
8861892607fffff,5,2.6,3.0,26.0,30,0.6,3,4,12.841068680000001,77.65379598,1.0,False,1.0,0.9709505941661296,0.125,WRONG PARKING,MOTOR CYCLE,Electronic City,No Junction,"Neeladri Road, Concorde Cuppertino, Phase 1, Electronic City, Bengaluru, Karnataka. Pin-560100 (India)",0.00044553352639786146,0.3777777777777778,0.125,0.0,0.31706433173444815,0.13869325104111968,16.433770172802284,low,3.25
8861892621fffff,53,3.290880503144654,3.6666666666666665,42.924528301886795,50,1.169811320754717,12,14,12.855447000000002,77.66451037924527,2.0,False,1.0,2.6886562718865603,0.5,WRONG PARKING,CAR,Electronic City,No Junction,"Hosur Road, Nanjuda Reddy Layout, Phase 1, Electronic City, Bengaluru, Karnataka. Pin-560100 (India)",0.0057919358431721985,0.6848357791754017,0.5,1.0,0.8779818552565434,0.43818507396732553,53.59519401217029,moderate,16.25
8861892627fffff,8,3.0,3.0,30.0,30,1.9500000000000002,4,6,12.86573005,77.658748375,1.0,False,1.0,1.29879494026259,0.16666666666666666,NO PARKING,MAXI-CAB,Electronic City,No Junction,"Hosur Road, Salarpuria Symphony Commercial Building, Pragathi Nagar, Chikkathoguru, Bengaluru, Karnataka. Pin-560100 (India)",0.0007796836711962575,0.5555555555555556,0.16666666666666666,0.0,0.4241220431330579,0.1980525574408924,23.799167739855015,low,4.0
886189262bfffff,76,2.6578947368421053,3.0,26.907894736842106,30,0.6171052631578947,4,7,12.85220967105263,77.659233275,1.0,False,1.0,1.214557745492221,0.16666666666666666,WRONG PARKING,SCOOTER,Electronic City,No Junction,"Road Number 1, Salarpuria Infozone, Phase 1, Electronic City, Bengaluru, Karnataka. Pin-560100 (India)",0.008353753619959901,0.4035087719298246,0.16666666666666666,0.0,0.39661435116236504,0.16011246716143332,19.09150072710234,low,26.907894736842103
886189262dfffff,4,2.5,2.5,25.0,25,1.45,3,1,12.860889875,77.674689425,1.0,False,1.0,1.4999999995671913,0.125,WRONG PARKING,CAR,Electronic City,No Junction,"1st Main Road, Aswani Aaeesha, Doddanagamangala, Bengaluru, Karnataka. Pin-560100 (India)",0.00033415014479839606,0.3333333333333333,0.125,0.0,0.4898256412809252,0.14136962967924688,16.765859509847665,low,10.0
8861892635fffff,2,2.5,2.5,25.0,25,0.6,2,2,12.85982875,77.6476569,1.0,False,1.0,-1.4426951601859516e-10,0.08333333333333333,WRONG PARKING,SCOOTER,Electronic City,No Junction,"Neeladri Road, Elite Greenwoods, Vittasandra, Bengaluru, Karnataka. Pin-560068 (India)",0.00011138338159946537,0.3333333333333333,0.08333333333333333,0.0,0.0,0.09586674834781317,11.119789301491688,low,2.5
8861892639fffff,544,2.698529411764706,4.0,27.53676470588235,70,0.9380514705882353,16,74,12.841934132169118,77.64586950404411,2.0,False,1.0,2.277874862905298,0.6666666666666666,WRONG PARKING,SCOOTER,Electronic City,No Junction,"Neeladri Road, Ajmera Annex, Karuna Nagar, Doddathogur, Bengaluru, Karnataka. Pin-560100 (India)",0.06048117620850969,0.42156862745098045,0.6666666666666666,1.0,0.7438410105103876,0.40304379056612905,49.23480742808321,moderate,20.243243243243242
886189263bfffff,4,3.0,3.0,30.0,30,1.225,3,4,12.842947975000001,77.64107995,1.0,False,1.0,0.8112781241705938,0.125,NO PARKING,CAR,Electronic City,No Junction,"Neeladri Road, Vittasandra, Bangalore South, Bengaluru Urban, Karnataka, 560100, India",0.00033415014479839606,0.5555555555555556,0.125,0.0,0.2649232183841032,0.17893299140305668,21.426781441575788,low,3.0
8861892645fffff,21,3.4484126984126986,4.166666666666667,50.714285714285715,70,2.5714285714285716,3,6,12.828452866666666,77.68190474285714,2.0,False,1.0,2.439005516594879,0.125,NO PARKING,HGV,Electronic City,No Junction,"Hosur Road, Mahendra Aarya Homes, Ananath Nagar Phase 1, Kammasandra Anekal Taluka, Bengaluru, Karnataka. Pin-560100 (India)",0.0022276676319893073,0.7548500881834216,0.125,1.0,0.7964582943695182,0.39184748588501367,47.845552056686486,moderate,17.75
886189264dfffff,44,3.3456439393939394,3.8333333333333335,46.13636363636363,70,1.3045454545454545,10,18,12.820991211363635,77.68698568409091,2.0,False,1.0,2.5166147207703222,0.4166666666666667,WRONG PARKING,SCOOTER,Electronic City,No Junction,"Hosur Road, Sattva Texonic, Bommasandra Industrial Area, Bommasandra, Bengaluru, Karnataka. Pin-560099 (India)",0.00478948540877701,0.7091750841750842,0.4166666666666667,1.0,0.821801613177419,0.4269747457205977,52.204198574349135,moderate,11.277777777777779
8861892661fffff,5,3.0,3.0,28.0,30,0.74,3,3,12.841899960000001,77.67753622000001,1.3,False,1.0,1.37095059402186,0.125,NO PARKING,SCOOTER,Electronic City,No Junction,"Hosur Road, Salarpuria Sattva Alexandria Tech Park, Veerasandra Industrial Area, Bengaluru, Karnataka. Pin-560100 (India)",0.00044553352639786146,0.5555555555555556,0.125,0.30000000000000004,0.4476845027207096,0.22958730916446501,27.71205011179767,low,4.666666666666667
8861892663fffff,36,3.0416666666666665,3.5,34.72222222222222,50,1.0805555555555555,8,14,12.842016500468088,77.67559646702466,2.0,False,1.0,2.0411244278598164,0.3333333333333333,NO PARKING,MOTOR CYCLE,Electronic City,No Junction,"Hosur Road, Pramuk Aqua Heights, Electronic City, Bengaluru, Karnataka. Pin-560100 (India)",0.0038984183559812877,0.574074074074074,0.3333333333333333,1.0,0.666530054715722,0.36801044840257063,44.8878143652029,moderate,8.928571428571429
886189266bfffff,102,2.940359477124183,3.5,31.96078431372549,50,0.9323529411764705,16,26,12.839258226750667,77.67755799266693,2.0,False,1.0,2.0944732939081807,0.6666666666666666,NO PARKING,SCOOTER,Electronic City,No Junction,"Hosur Road, Salarpuria Sattva Alexandria Tech Park, Veerasandra Industrial Area, Bengaluru, Karnataka. Pin-560100 (India)",0.011249721541546001,0.529048656499637,0.6666666666666666,1.0,0.6839511497349067,0.41035317256616555,50.14176722369049,moderate,12.538461538461538
886189266dfffff,2,3.0,3.0,30.0,30,0.6,2,2,12.842416799999999,77.68671255,1.3,False,1.0,-1.4426951601859516e-10,0.08333333333333333,NO PARKING,MOTOR CYCLE,Electronic City,No Junction,"2nd Cross Street, GPR Royale Layout, Ananath Nagar Phase 1, Kammasandra Anekal Taluka, Bengaluru, Karnataka. Pin-560100 (India)",0.00011138338159946537,0.5555555555555556,0.08333333333333333,0.30000000000000004,0.0,0.18742230390336875,22.48014889864547,low,3.0
88618926b1fffff,3,2.8333333333333335,3.0,28.333333333333332,30,1.5333333333333332,3,3,12.8509956,77.58796083333333,1.0,False,1.0,0.9182958337659504,0.125,NO PARKING,CAR,Thalagattapura,No Junction,"SH 87, Royal Hermitage Layout, Weavers Colony, Bengaluru, Karnataka. Pin-560083 (India)",0.00022276676319893073,0.48148148148148157,0.125,0.0,0.29986989721146645,0.1631767921762474,19.47172707032755,low,2.833333333333333
88618926b5fffff,24,2.8333333333333335,3.0,28.333333333333332,30,1.2916666666666667,10,12,12.857850741666667,77.58917952916666,1.0,False,1.0,2.1194140296982886,0.4166666666666667,NO PARKING,CAR,Hulimavu,No Junction,"Bannerghatta Main Road, Anjanapura Upavalaya, Gottigere, Bengaluru, Karnataka. Pin-560083 (India)",0.0025618177767877033,0.48148148148148157,0.4166666666666667,0.0,0.6920955576714118,0.23900656031711964,28.880805842465822,low,5.666666666666666
88618926b9fffff,1,4.0,4.0,70.0,70,1.3,1,1,12.8458396,77.5879195,2.0,False,1.0,-1.4426951601859516e-10,0.041666666666666664,PARKING IN A MAIN ROAD,CAR,Thalagattapura,No Junction,"Bannerghatta Main Road, Prestige Park Square, Royal Hermitage Layout, Weavers Colony, Bengaluru, Karnataka. Pin-560083 (India)",0.0,1.0,0.041666666666666664,1.0,0.0,0.37625,45.91019109043943,moderate,7.0
88618926bdfffff,4,3.125,3.5,35.0,50,2.15,3,3,12.852531725,77.58856925,2.0,False,1.0,0.9999999997114609,0.125,NO PARKING,CAR,Hulimavu,No Junction,"Bannerghatta Main Road, Dawoodi Bohra Colony, Gottigere, Bengaluru, Karnataka. Pin-560083 (India)",0.00033415014479839606,0.6111111111111112,0.125,1.0,0.3265504275363206,0.31775205702412296,38.6516728730877,low,4.666666666666666
8861892711fffff,5,2.8,3.0,28.0,30,1.04,3,3,12.87853256,77.67200004,1.0,False,1.0,1.9219280943102843,0.125,NO PARKING,CAR,Electronic City,No Junction,"Amrutha College Road, Balaji Layout, Naganathapura, Rayasandra, Bengaluru, Karnataka. Pin-560100 (India)",0.00044553352639786146,0.46666666666666656,0.125,0.0,0.627606441028745,0.18575884200688558,22.27374388908005,low,4.666666666666667
8861892715fffff,7,3.333333333333333,3.5,44.285714285714285,50,0.9,3,3,12.8894083,77.67045104285714,2.0,False,1.0,2.128085278170047,0.125,PARKING IN A MAIN ROAD,MOTOR CYCLE,Electronic City,No Junction,"Silver County Road, Choodasandra Circle, Kasavanahalli, Bengaluru, Karnataka. Pin-560035 (India)",0.0006683002895967921,0.7037037037037036,0.125,1.0,0.6949271575675466,0.37047058861820864,45.19307249333592,moderate,10.333333333333334
8861892717fffff,2,2.75,3.0,27.5,30,0.95,2,2,12.89054595,77.66833704999999,1.0,False,1.0,0.9999999997114609,0.08333333333333333,WRONG PARKING,SCOOTER,Electronic City,No Junction,"Silver County Road, SNN Raj Etternia, Parappana Agrahara, Bengaluru, Karnataka. Pin-560035 (India)",0.00011138338159946537,0.4444444444444444,0.08333333333333333,0.0,0.3265504275363206,0.14976856032849659,17.80801224244875,low,2.75
8861892719fffff,22,2.7196969696969697,3.5,30.0,50,0.9181818181818181,10,11,12.875791472727274,77.67119115,2.0,False,1.0,1.937434188126676,0.4166666666666667,WRONG PARKING,SCOOTER,Electronic City,No Junction,"Amrutha College Road, Rayasandra Circle, Rayasandra, Bengaluru, Karnataka. Pin-560100 (India)",0.0023390510135887724,0.430976430976431,0.4166666666666667,1.0,0.6326699625946365,0.3415594200557553,41.60572851130851,moderate,6.0
886189271dfffff,1,2.5,2.5,25.0,25,1.3,1,1,12.8817929,77.6731186,1.0,False,1.0,-1.4426951601859516e-10,0.041666666666666664,WRONG PARKING,CAR,Electronic City,No Junction,"1st Cross Road, Sri Venkateshwara Layout, Parappana Agrahara, Bengaluru, Karnataka. Pin-560068 (India)",0.0,0.3333333333333333,0.041666666666666664,0.0,0.0,0.08958333333333333,10.34013312847735,low,2.5
8861892721fffff,50,2.525,3.0,25.4,30,0.858,8,13,12.907125778,77.69573430999999,1.0,False,1.0,2.017152695683907,0.3333333333333333,WRONG PARKING,SCOOTER,Bellandur,No Junction,"Sarjapura Main Road, Doddakannelli Circle, Doddakannelli, Bengaluru, Karnataka. Pin-560035 (India)",0.005457785698373803,0.3444444444444444,0.3333333333333333,0.0,0.6587020753237635,0.1904446128465243,22.855161820576868,low,9.76923076923077
8861892723fffff,81,2.8971193415637857,3.75,29.814814814814813,50,1.2629629629629628,13,37,12.910494612345678,77.68527316296297,2.0,False,1.0,1.6595546770123601,0.5416666666666666,NO PARKING,CAR,Bellandur,No Junction,"Sarjapura Main Road, Saket Callipolis, Halanayakana Halli, Bengaluru, Karnataka. Pin-560035 (India)",0.008910670527957229,0.5098308184727937,0.5416666666666666,1.0,0.5419282894235816,0.3747351689304721,45.72222843132657,moderate,6.527027027027026
8861892725fffff,11,2.5454545454545454,3.0,25.0,25,0.7000000000000001,8,4,12.915573109090907,77.69869123636363,1.3,False,1.0,1.6767370294750545,0.3333333333333333,WRONG PARKING,MOTOR CYCLE,Bellandur,No Junction,"Gear School Road, AET Junction, Doddakannelli, Bengaluru, Karnataka. Pin-560035 (India)",0.0011138338159946536,0.35353535353535354,0.3333333333333333,0.30000000000000004,0.5475391939671638,0.2185211240460099,26.338940183607264,low,6.875
8861892727fffff,2,3.0,3.0,30.0,30,1.3,2,2,12.917605550000001,77.68840795,1.0,False,1.0,-1.4426951601859516e-10,0.08333333333333333,NO PARKING,CAR,HAL Old Airport,No Junction,"Bellandur Doddakannelli Road, Condominiums, Adarsh Palm Retreat, Bellandur, Bengaluru, Karnataka. Pin-560103 (India)",0.00011138338159946537,0.5555555555555556,0.08333333333333333,0.0,0.0,0.15142230390336875,18.013211387143258,low,3.0
8861892729fffff,61,2.5163934426229506,3.0,25.16393442622951,30,1.3475409836065575,11,16,12.906245668909762,77.69811530527274,1.0,False,1.0,2.5827434676430676,0.4583333333333333,WRONG PARKING,MAXI-CAB,Bellandur,No Junction,"Sarjapura Main Road, Nimritha Kethana Eternal Accolade, Janatha Colony, Doddakannelli, Bengaluru, Karnataka. Pin-560035 (India)",0.006683002895967922,0.3406193078324225,0.4583333333333333,0.0,0.8433959837442705,0.22338140652643762,26.942011798282806,low,9.59375
886189272bfffff,3,2.25,2.5,25.0,25,1.4333333333333333,2,1,12.9015009,77.6884182,1.0,False,1.0,1.5849625002883474,0.08333333333333333,WRONG PARKING,LGV,Bellandur,No Junction,"1st Main Road, Halanayakana Halli, Bengaluru, Karnataka. Pin-560035 (India)",0.00022276676319893073,0.2222222222222222,0.08333333333333333,0.0,0.5175701822199764,0.10952800016211335,12.814899251029887,low,7.5
886189272dfffff,1,3.0,3.0,25.0,25,1.3,1,1,12.90915890859921,77.70451985299587,1.3,False,1.0,-1.4426951601859516e-10,0.041666666666666664,WRONG PARKING,CAR,Bellandur,No Junction,"Chikkabellanduru Road, Joval Farms, Janatha Colony, Doddakannelli, Bengaluru, Karnataka. Pin-560035 (India)",0.0,0.5555555555555556,0.041666666666666664,0.30000000000000004,0.0,0.1811388888888889,21.700492725631133,low,2.5
8861892731fffff,173,2.921965317919075,3.75,29.277456647398843,50,1.0387283236994218,16,42,12.901032885549132,77.67557480057803,2.0,False,1.0,1.6797150110942105,0.6666666666666666,NO PARKING,CAR,Bellandur,No Junction,"Amrutha College Road, Kristal Jasper Villa, Haralur, Bengaluru, Karnataka. Pin-560035 (India)",0.01915794163510804,0.5208734746307001,0.6666666666666666,1.0,0.5485116551382347,0.3998466835592662,48.83810528315982,moderate,12.059523809523807
8861892733fffff,2,2.5,2.5,25.0,25,0.6,2,2,12.90296835,77.66129864999999,1.0,False,1.0,0.9999999997114609,0.08333333333333333,WRONG PARKING,MOTOR CYCLE,HSR Layout,No Junction,"Haralur Road, Abhee Nandana, Ambalipura, Bengaluru, Karnataka. Pin-560102 (India)",0.00011138338159946537,0.3333333333333333,0.08333333333333333,0.0,0.3265504275363206,0.12199078255071882,14.36130119962297,low,2.5
8861892735fffff,201,2.7251243781094527,3.75,27.81094527363184,60,1.0119402985074628,14,58,12.91258603277578,77.6788301478371,2.0,False,1.0,2.215697271602717,0.5833333333333334,WRONG PARKING,CAR,Bellandur,No Junction,"Sarjapura Main Road, Kaikondrahalli, Bengaluru, Karnataka. Pin-560035 (India)",0.022276676319893073,0.43338861249309013,0.5833333333333334,1.0,0.7235368914844218,0.3804131073379942,46.42675609967545,moderate,9.637931034482758
8861892737fffff,16,3.0,3.0,30.0,30,0.6749999999999999,4,8,12.913817175,77.666580625,1.0,False,1.0,1.5052408145113394,0.16666666666666666,NO PARKING,SCOOTER,Bellandur,No Junction,"Haralur Road, Alaya Villament, Ambalipura, Bengaluru, Karnataka. Pin-560102 (India)",0.0016707507239919804,0.5555555555555556,0.16666666666666666,0.0,0.49153703164182244,0.20371307663743227,24.5015340046773,low,6.0
8861892739fffff,132,2.728535353535354,3.75,27.765151515151516,60,0.8856060606060606,17,37,12.898741727343301,77.6754439261125,2.0,False,1.0,2.2875912319187925,0.7083333333333334,WRONG PARKING,SCOOTER,Bellandur,No Junction,"Amrutha College Road, Azalea, Owners Court Layout, Kasavanahalli, Bengaluru, Karnataka. Pin-560035 (India)",0.014591222989529962,0.43490460157126837,0.7083333333333334,1.0,0.7470138949663027,0.39911462888698024,48.747270769934694,moderate,9.905405405405405
8861892767fffff,71,2.6232394366197185,3.25,26.338028169014084,40,1.111267605633803,12,37,12.903529495302454,77.70451123254942,1.5,False,1.0,1.9116046702926102,0.5,WRONG PARKING,CAR,Bellandur,No Junction,"Chikkabellanduru Road, Ram Circle, Hadosiddapura, Bengaluru, Karnataka. Pin-560035 (India)",0.007796836711962575,0.3881064162754304,0.5,0.5,0.6242353225016485,0.28430448088257826,34.501444191546234,low,5.054054054054054
886189276dfffff,63,2.7387566137566135,3.875,31.03174603174603,70,1.0746031746031746,14,31,12.896621146031746,77.72007064920635,2.0,False,1.0,2.7182456012008074,0.5833333333333334,WRONG PARKING,SCOOTER,Whitefield,No Junction,"Sarjapura Main Road, Kodathi Gate, Kodathi, Bengaluru, Karnataka. Pin-560035 (India)",0.006905769659166852,0.43944738389182825,0.5833333333333334,1.0,0.8876442633960178,0.39044511794238856,47.671544002024255,moderate,6.306451612903226
8861892a95fffff,1,2.5,2.5,25.0,25,1.3,1,1,13.044354,77.7605374,1.0,False,1.0,-1.4426951601859516e-10,0.041666666666666664,WRONG PARKING,CAR,K.R. Pura,No Junction,"Whitefield Main Road, Subhash Nagar, Sannatammanahalli, Bengaluru, Karnataka. Pin-560049 (India)",0.0,0.3333333333333333,0.041666666666666664,0.0,0.0,0.08958333333333333,10.34013312847735,low,2.5
8861892abbfffff,29,3.117816091954023,4.0,37.58620689655172,70,1.0999999999999999,7,10,13.053881641379311,77.76221403448275,2.0,False,1.0,2.581156295344755,0.2916666666666667,NO PARKING,MOTOR CYCLE,K.R. Pura,No Junction,"MBT Road, Brigade Golden Triangle, Sannatammanahalli, Bengaluru, Karnataka. Pin-560049 (India)",0.00311873468478503,0.6079182630906769,0.2916666666666667,1.0,0.842877691951608,0.3840954015342334,46.88366104616344,moderate,10.899999999999999
8861892c11fffff,1,2.5,2.5,25.0,25,0.6,1,1,13.0393993,77.6412716,1.0,False,1.0,-1.4426951601859516e-10,0.041666666666666664,WRONG PARKING,SCOOTER,Hennuru,No Junction,"Kempegowda Road, Skyline Retreat, Vaddrapalya, Hennuru, Bengaluru, Karnataka. Pin-560043 (India)",0.0,0.3333333333333333,0.041666666666666664,0.0,0.0,0.08958333333333333,10.34013312847735,low,2.5
8861892c15fffff,4,3.0,3.5,33.75,50,1.125,3,4,13.0487827,77.64538247499999,2.0,False,1.0,0.8112781241705938,0.125,NO PARKING,CAR,Hennuru,No Junction,"Hennur Main Road, Geddalahalli, Bengaluru, Karnataka. Pin-560077 (India)",0.00033415014479839606,0.5555555555555556,0.125,1.0,0.2649232183841032,0.2989329914030567,36.316573146583174,low,3.375
8861892c1bfffff,7,3.0,3.0,30.0,30,0.7571428571428571,4,5,13.032744371428572,77.63719095714285,1.0,False,1.0,1.8423709926000305,0.16666666666666666,NO PARKING,SCOOTER,Hennuru,No Junction,"HDFC Bank, 487/31/1, Hennuru - Bagaluru Road, Hennur, HBR Layout, Bengaluru North City Corporation, Bengaluru, Bangalore North, Bengaluru Urban, Karnataka, 560043, India",0.0006683002895967921,0.5555555555555556,0.16666666666666666,0.0,0.601627035447963,0.21221954181160496,25.557029792921725,low,4.2
8861892c31fffff,29,2.810344827586207,3.0,28.103448275862068,30,1.2655172413793105,10,12,13.060459493103448,77.64898141724139,1.0,False,1.0,0.7856911757791798,0.4166666666666667,NO PARKING,CAR,Hennuru,No Junction,"Hennur Main Road, Muninanjappa Layout, Narayanpura, Kothnur Narayanapura, Bengaluru, Karnataka. Pin-560077 (India)",0.00311873468478503,0.47126436781609193,0.4166666666666667,0.0,0.25656778944633174,0.20177713551516502,24.261319337479655,low,6.791666666666666
8861892c35fffff,5,3.4,3.75,42.0,50,0.74,3,3,13.064053179999998,77.65032922,2.0,False,1.0,0.7219280945988233,0.125,NO PARKING,SCOOTER,Hennuru,No Junction,"Hennur Main Road, Arge Helios, Sangam Enclave, Kothnur Narayanapura, Bengaluru, Karnataka. Pin-560077 (India)",0.00044553352639786146,0.7333333333333333,0.125,1.0,0.23574592802284927,0.3410766676330806,41.5458278194859,moderate,7.0
8861892c39fffff,15,2.6333333333333333,3.0,26.333333333333332,30,1.3266666666666669,9,7,13.056491753333335,77.6509771,1.0,False,1.0,1.2366407413640892,0.375,WRONG PARKING,CAR,Hennuru,No Junction,"Byrathi Main Road, Hoodi, Kothnur Narayanapura, Bengaluru, Karnataka. Pin-560077 (India)",0.001559367342392515,0.3925925925925926,0.375,0.0,0.4038255629066468,0.18717200338339768,22.449091210261937,low,5.642857142857142
8861892c3bfffff,6,2.6666666666666665,3.0,26.666666666666668,30,1.1833333333333333,5,5,13.0527723,77.6460748,1.0,False,1.0,0.6500224213598151,0.20833333333333334,WRONG PARKING,CAR,Hennuru,No Junction,"Hennur Main Road, K Narayanpura Cross, Kothnur Narayanapura, Bengaluru, Karnataka. Pin-560077 (India)",0.0005569169079973268,0.40740740740740733,0.20833333333333334,0.0,0.21226509968097662,0.15025013489872915,17.86776678445868,low,3.2
8861892c3dfffff,3,2.8333333333333335,3.0,28.333333333333332,30,1.3,3,3,13.060484366666666,77.65217656666665,1.0,False,1.0,-1.4426951601859516e-10,0.125,NO PARKING,CAR,Hennuru,No Junction,"Doddagubbi Road, Chikka Aneppa Layout, Narayanpura, Kothnur Narayanapura, Bengaluru, Karnataka. Pin-560077 (India)",0.00022276676319893073,0.48148148148148157,0.125,0.0,0.0,0.13918720039933008,16.49506019827374,low,2.833333333333333
8861892c49fffff,1,2.5,2.5,25.0,25,1.3,1,1,13.0207568,77.6855388,1.0,False,1.0,-1.4426951601859516e-10,0.041666666666666664,WRONG PARKING,CAR,K.R. Pura,No Junction,"TC Palya Main Road, Aneppa Circle, Ramamurthi Nagar, Bengaluru, Karnataka. Pin-560016 (India)",0.0,0.3333333333333333,0.041666666666666664,0.0,0.0,0.08958333333333333,10.34013312847735,low,2.5
8861892c4bfffff,8,2.609375,3.0,26.875,30,1.4500000000000002,6,8,13.0203875375,77.6758368625,1.0,False,1.0,1.7499999994229218,0.25,WRONG PARKING,CAR,Banaswadi,No Junction,"TC Palya Main Road, Raghavendra Circle, Ramamurthi Nagar, Bengaluru, Karnataka. Pin-560016 (India)",0.0007796836711962575,0.3819444444444444,0.25,0.0,0.571463248129672,0.17893707606284376,21.427288272687584,low,2.6875
8861892c51fffff,22,2.772727272727273,3.5,28.40909090909091,50,1.1772727272727275,9,13,13.021917082784325,77.6575440778468,2.0,False,1.0,2.1110957867434528,0.375,WRONG PARKING,CAR,Hennuru,No Junction,"Horamavu Main Road, Sycon Cressida, Ashirwad Colony, Horamavu, Bengaluru, Karnataka. Pin-560043 (India)",0.0023390510135887724,0.45454545454545464,0.375,1.0,0.6893792318777673,0.34573841749066164,42.12426518915448,moderate,4.807692307692308
8861892c53fffff,9,2.9444444444444446,3.0,29.444444444444443,30,0.8333333333333334,3,3,13.0219659,77.64754467777777,1.0,False,1.0,1.530493056324674,0.125,NO PARKING,SCOOTER,Hennuru,No Junction,"MBT Road, Sri Bhaktha Kanakadasa Circle, Babusapalya, Bengaluru, Karnataka. Pin-560043 (India)",0.0008910670527957229,0.5308641975308643,0.125,0.0,0.499783162003407,0.19171602245882735,23.012920356401338,low,8.833333333333332
